{
  "schema_version": 1,
  "run": {
    "mode": "batch",
    "repo": "Factory-Academy/Telecom-Demo-NextJS-Springboot",
    "workflow": "Nightly Test Suite",
    "run_id": "nightly-20260315",
    "run_url": "",
    "pr_number": null,
    "head_sha": "",
    "head_ref": "main",
    "base_ref": "main",
    "failed_jobs": ["rc-artifact-registry-503", "rc-runner-disk-full", "rc-spotless-drift"]
  },
  "funnel": {
    "tests_run": 2000,
    "failures": 106,
    "retried_failures": 19,
    "clusters": 10
  },
  "clusters": [
    {
      "cluster_id": "c1",
      "signature": "assertEquals|BillingCycleService.prorate|prorated amount",
      "failing_tests": [
        "com.example.demo.billing.BillingCycleServiceTest.filtersTheInvoiceTotal1",
        "com.example.demo.billing.BillingCycleServiceTest.normalizesTheInvoiceTotal4",
        "com.example.demo.billing.BillingCycleServiceTest.returnsAMidCycleUpgrade7",
        "com.example.demo.billing.BillingCycleServiceTest.rendersAMidCycleUpgrade10",
        "com.example.demo.billing.BillingCycleServiceTest.validatesAPartialMonth13",
        "com.example.demo.billing.BillingCycleServiceTest.paginatesAPartialMonth16",
        "com.example.demo.billing.BillingCycleServiceTest.normalizesAMidCycleUpgrade19",
        "com.example.demo.billing.BillingCycleServiceTest.persistsAPartialMonth22",
        "com.example.demo.billing.ProrationTest.rendersTheInvoiceTotal2",
        "com.example.demo.billing.ProrationTest.normalizesAPartialMonth5",
        "com.example.demo.billing.ProrationTest.validatesAMidCycleUpgrade8",
        "com.example.demo.billing.ProrationTest.filtersAPartialMonth11",
        "com.example.demo.billing.ProrationTest.normalizesAPartialMonth14",
        "com.example.demo.billing.ProrationTest.returnsTheProratedAmount17",
        "com.example.demo.billing.ProrationTest.returnsAPartialMonth20",
        "com.example.demo.billing.ProrationTest.excludesTheProratedAmount23",
        "com.example.demo.controller.InvoiceControllerTest.persistsTheInvoiceTotal3",
        "com.example.demo.controller.InvoiceControllerTest.validatesAPartialMonth6",
        "com.example.demo.controller.InvoiceControllerTest.normalizesAMidCycleUpgrade9",
        "com.example.demo.controller.InvoiceControllerTest.rejectsTheProratedAmount12",
        "com.example.demo.controller.InvoiceControllerTest.excludesAPartialMonth15",
        "com.example.demo.controller.InvoiceControllerTest.returnsTheInvoiceTotal18",
        "com.example.demo.controller.InvoiceControllerTest.aggregatesAPartialMonth21"
      ],
      "jobs": [],
      "retry_count": 0,
      "classification": "product-code",
      "route": "needs-human",
      "confidence": 0.6,
      "root_cause": "Every failure in this cluster unwinds through BillingCycleService.prorate called from chargeFor, and every message is a money comparison off by a fixed quantum: 0.01, 0.02, 0.50 or exactly 1.00. Mid-cycle upgrade and partial-month cases dominate. The pattern is a rounding/scale defect in prorate (a double or a HALF_UP/HALF_EVEN choice where a BigDecimal with an explicit scale belongs), not 23 independent assertion mistakes. It is not resolvable from the bundle alone because the deltas run in both directions (expected 279.55 got 279.56, but also expected 12.12 got 12.11) and two ProrationTest messages report a tolerance larger than the observed difference (expected 633.15 got 633.17, delta 0.101), so the tests' own tolerance contract is inconsistent.",
      "target_files": ["backend/src/main/java/com/example/demo/billing/BillingCycleService.java"],
      "proposed_fix": "Pin the proration arithmetic to BigDecimal with scale 2 and one declared RoundingMode, then make the assertions in BillingCycleServiceTest, ProrationTest and InvoiceControllerTest agree on a single tolerance. Do not change prorate before the rounding policy is decided.",
      "verification": "cd backend && ./gradlew test --tests '*ProrationTest*' --tests '*BillingCycleServiceTest*' --tests '*InvoiceControllerTest*'",
      "human_note": "Billing needs to state the rounding policy for prorated charges (which RoundingMode, at what scale, and whether the whole-dollar deltas of exactly 1.00 are a separate day-count bug). That is a finance decision, not an inference. Also note: backend/src/main/java/com/example/demo/billing/ does not exist in this checkout and never has (git log --all over that path is empty), so the agent could not read prorate or run the verification command. Confirm the nightly job ran against the branch it claims before acting."
    },
    {
      "cluster_id": "c2",
      "signature": "assertEquals|UsageAggregator.bucketFor|daily bucket total",
      "failing_tests": [
        "com.example.demo.usage.UsageAggregatorTest.aggregatesTheUsageWindow24",
        "com.example.demo.usage.UsageAggregatorTest.rendersTheDailyBucket26",
        "com.example.demo.usage.UsageAggregatorTest.validatesTheUsageWindow28",
        "com.example.demo.usage.UsageAggregatorTest.returnsTheUsageWindow30",
        "com.example.demo.usage.UsageAggregatorTest.persistsTheRollup32",
        "com.example.demo.usage.UsageAggregatorTest.normalizesAMidnightRecord34",
        "com.example.demo.usage.UsageAggregatorTest.excludesAMidnightRecord36",
        "com.example.demo.controller.UsageRecordControllerTest.paginatesTheRollup25",
        "com.example.demo.controller.UsageRecordControllerTest.rejectsAMidnightRecord27",
        "com.example.demo.controller.UsageRecordControllerTest.paginatesTheRollup29",
        "com.example.demo.controller.UsageRecordControllerTest.persistsTheRollup31",
        "com.example.demo.controller.UsageRecordControllerTest.normalizesTheRollup33",
        "com.example.demo.controller.UsageRecordControllerTest.validatesTheRollup35",
        "com.example.demo.controller.UsageRecordControllerTest.validatesTheRollup37"
      ],
      "jobs": [],
      "retry_count": 0,
      "classification": "product-code",
      "route": "needs-human",
      "confidence": 0.58,
      "root_cause": "All 14 failures unwind through UsageAggregator.bucketFor and UsageAggregator.rollup, and each message compares a per-day bucket total that is off by 0.01, 0.02, 0.50 or 1.00 (expected 491.6 records in bucket 2026-03-09 but found 491.62). The aggregator is accumulating a floating-point sum per bucket, so bucket totals drift with input order and record count. The messages also describe fractional 'records', which means the assertion text and the quantity being summed disagree about what is being counted.",
      "target_files": ["backend/src/main/java/com/example/demo/usage/UsageAggregator.java"],
      "proposed_fix": "Accumulate bucket totals in BigDecimal (or in integer minor units) inside bucketFor/rollup and round once at the boundary, and correct the assertion messages to say cost rather than records.",
      "verification": "cd backend && ./gradlew test --tests '*UsageAggregatorTest*' --tests '*UsageRecordControllerTest*'",
      "human_note": "Someone owning usage billing has to say what precision a daily rollup carries and whether the 0.50 and 1.00 deltas are the same defect as the 0.01 ones or a second bug in bucket boundary assignment. backend/src/main/java/com/example/demo/usage/ is absent from this checkout and from all git history, so neither the source nor the verification command was available to the agent. Shares a shape with c1 but a different symbol and module; kept separate because the root cause is not proven to be shared."
    },
    {
      "cluster_id": "c3",
      "signature": "NullPointerException|CustomerExporter.row|Plan.getName",
      "failing_tests": [
        "com.example.demo.export.CustomerExportTest.paginatesTheExportRow38",
        "com.example.demo.export.CustomerExportTest.rejectsADeletedPlan40",
        "com.example.demo.export.CustomerExportTest.validatesTheCsvHeader42",
        "com.example.demo.export.CustomerExportTest.rendersADeletedPlan44",
        "com.example.demo.export.CustomerExportTest.excludesTheExportRow46",
        "com.example.demo.export.CustomerExportTest.persistsACustomerWithoutAPlan48",
        "com.example.demo.export.CustomerExportTest.excludesTheCsvHeader50",
        "com.example.demo.export.CustomerExportTest.persistsADeletedPlan52",
        "com.example.demo.controller.CustomerControllerTest.returnsACustomerWithoutAPlan39",
        "com.example.demo.controller.CustomerControllerTest.validatesTheCsvHeader41",
        "com.example.demo.controller.CustomerControllerTest.validatesACustomerWithoutAPlan43",
        "com.example.demo.controller.CustomerControllerTest.rejectsACustomerWithoutAPlan45",
        "com.example.demo.controller.CustomerControllerTest.filtersTheCsvHeader47",
        "com.example.demo.controller.CustomerControllerTest.rendersACustomerWithoutAPlan49",
        "com.example.demo.controller.CustomerControllerTest.filtersADeletedPlan51",
        "com.example.demo.controller.CustomerControllerTest.filtersADeletedPlan53"
      ],
      "jobs": [],
      "retry_count": 0,
      "classification": "product-code",
      "route": "needs-human",
      "confidence": 0.72,
      "root_cause": "CustomerExporter.row dereferences Customer.getPlan().getName() without a null check, so any customer whose plan is null throws NullPointerException and takes the whole CSV export down. The test names state the rule the source breaks: returnsACustomerWithoutAPlan, persistsACustomerWithoutAPlan, rejectsADeletedPlan. The domain confirms the rule is real: Customer.plan is a @ManyToOne on @JoinColumn(name = \"plan_id\") with no nullable = false (backend/src/main/java/com/example/demo/model/Customer.java:32-33), so a planless customer is a legal row. An NPE is never the correct expectation, so the source is at fault, not the tests.",
      "target_files": [
        "backend/src/main/java/com/example/demo/export/CustomerExporter.java",
        "backend/src/main/java/com/example/demo/model/Customer.java"
      ],